ID,PUBLISHED,UPDATED,TITLE,CONTENT,CONTENT_SIZE,HAS_LINK,AUTHOR_NAME,AUTHOR_URI,CHANNELID
gebwZmubhFuuWFc9yx_Zh20UxkKAGnu7u7CRbu64528,2013-08-11T22:59:00,2013-08-11T22:59:00,Then Why The Hell ...,Then Why The Hell Rï»¿ U Watching This Then U Fucking Noob,56,0,KYRSP33DYTROLLING,KYRSP33DYTROLLING,UCjS3jwujfKsy7WSP6cgkEbQ
gebwZmubhFtK2DvtOMUmjw_UxxDaU3qzP4hvhCvBEd8,2013-08-10T12:42:33,2013-08-10T12:42:33,Hey  i've created ...,Hey  i've created this cool tool that generate free PSN codes  you can download that here ==> bit.ly\15mxnMm . Thumb up so others can seeï»¿ !!,141,0,Kevin Harris,A3vPJB2O03kCDPOUrkLZzQ,UCA3vPJB2O03kCDPOUrkLZzQ
gebwZmubhFstihubd4Imy7irmF0Xyog5DWL_zocO34k,2013-08-10T12:41:59,2013-08-10T12:41:59,Hey  i've created ...,Hey  i've created this cool tool that generate free PSN codes  you can download that here ==>ï»¿ bit.ly\15mxnMm . Thumb up so others can see !!,141,0,Kevin Harris,A3vPJB2O03kCDPOUrkLZzQ,UCA3vPJB2O03kCDPOUrkLZzQ
gebwZmubhFvjEeX7F37-kZllWqJRFu0g0t06pUJRsI0,2013-08-10T12:41:51,2013-08-10T12:41:51,Hey  i've created ...,Hey  i've created this cool tool thatï»¿ generate free PSN codes  you can download that here ==> bit.ly\15mxnMm . Thumb up so others can see !!,141,0,Kevin Harris,A3vPJB2O03kCDPOUrkLZzQ,UCA3vPJB2O03kCDPOUrkLZzQ
gebwZmubhFs1zEt87IyeJhJGBdyTClKW_GkFthguD94,2013-08-10T10:36:53,2013-08-10T10:36:53,Hey  i've created ...,Hey  i've created this cool tool that generate free PSN codes  you can downloadï»¿ that here ==> bit.ly\15mxnMm . Thumb up so others can see !!,141,0,Kevin Harris,A3vPJB2O03kCDPOUrkLZzQ,UCA3vPJB2O03kCDPOUrkLZzQ
gebwZmubhFuhhyxTuMpX8FVPn3OLkNbRiAQdSRjGndg,2013-08-10T06:38:04,2013-08-10T06:38:04,Wish To Be A ...,Wish To Be A Jailbreak 4 PS4 When It Comesï»¿ Out,47,0,ReVeRz MoDz,4mEgmw9qe9w6YMWyWcLVzQ,UC4mEgmw9qe9w6YMWyWcLVzQ
gebwZmubhFszgMKx07xR5EhqtDiTkJqWdsJL4xBz7tQ,2013-08-10T06:37:14,2013-08-10T06:37:14,wowï»¿,wowï»¿,4,0,ReVeRz MoDz,4mEgmw9qe9w6YMWyWcLVzQ,UC4mEgmw9qe9w6YMWyWcLVzQ
gebwZmubhFsMuxclY9Y2bDVsZXhs0jB04OqkMQ7ufcY,2013-08-10T03:45:12,2013-08-10T03:45:12,Hey  i've created ...,Hey  i've created this cool tool that generate free PSN codes  you can download that here ==> bit.ly\16jULi9? . Thumb upï»¿ so others can see !!,142,0,Peter Hyden,ABfpUODjQYqJQTeZT1cXEg,UCABfpUODjQYqJQTeZT1cXEg
gebwZmubhFuGrA0fSmgQOkxNvwtrz8ci4vu-4wei0ds,2013-08-09T06:01:34,2013-08-09T06:01:34,Wowï»¿,Wowï»¿,4,0,jesse24la,jesse24la,UCml4PwU0E1h-iUes7y78lyA
gebwZmubhFuMq3g4aXFi6nPdu0K7vcivfJKN4eBEX0A,2013-08-08T15:54:56,2013-08-08T15:54:56,PSH?ï»¿,PSH?ï»¿,5,0,XxKaTaNa646xX,XxKaTaNa646xX,UCZSjse4nZAPLM0TSMnzjArQ
gebwZmubhFumE64xBZSVEGyhPAiWkzcJz1TMeK7n5M8,2013-08-08T06:35:04,2013-08-08T06:35:04,Hey  i've created ...,Hey  i've created this cool tool that generate free PSN codes  you can download that here ==> bit.ly\16jULi9? . Thumb up so others canï»¿ see !!,142,0,Jeffrey Baker,yuEfS_KwoNT_grpZDcBWJg,UCyuEfS_KwoNT_grpZDcBWJg
gebwZmubhFua82ar3f_LBGjMSY6CxiLYvhAZBmaeXe4,2013-08-07T17:13:11,2013-08-07T17:13:11,Will we be able to ...,Will we be able to play PS3 games on the PS4?ï»¿,46,0,D rOlja,BabanaBoyAssHole,UCn0qaN4EYQpKMXccMhl-Q4w
gebwZmubhFtzIoBpY8RlbznawIfF-OHypHfbo-T4pP0,2013-08-08T07:03:07,2013-08-08T07:03:07,No  the system does ...,No  the system does notï»¿ have backwards capability.,51,0,ForeverRepublic,ForeverRepublic,UCd4TJaEb9QYnpCoT4viE1wA
gebwZmubhFvy5NZwO0a3XPlaHTBSMw-Z5ccRPcbAdbw,2013-08-07T15:41:49,2013-08-07T15:41:49,This guy couldnt do ...,This guy couldnt do his hairï»¿ before leaving his hotel room?,60,0,nacevedo19,nacevedo19,UC6lVMexVyYe7Ol3EUGG3oag
gebwZmubhFt1ZbJwNP6V7Fr22oSITJ40WULI0zkomvo,2013-08-06T14:09:51,2013-08-06T14:09:51,Iï»¿ like Nintendo ...,Iï»¿ like Nintendo more,21,0,Erika Martin,koGsGTmUgNz-emiqkZmhkA,UCkoGsGTmUgNz-emiqkZmhkA
gebwZmubhFsofMjCGGjPD6V9HsN43cBqhMGsHdhk7sA,2013-08-06T10:45:08,2013-08-06T10:45:08,simply stunning! . ...,simply stunning! . dont waste time guys   rush to this siteï»¿ and get ur ipad3 or iphone as per ur choice. dont think its funny  make sure you tell the address and email properly to send the giftbox. go here  --> bit.ly/13h3YDX?=yzjdys,234,0,Jai Makhecha,yQqTqnXMILwvVryWWeCSUg,UCyQqTqnXMILwvVryWWeCSUg
gebwZmubhFvV58dPWENTl9guo6uaL9jNbGaiJi0Uf6U,2013-08-06T07:18:51,2013-08-06T07:18:51,I like playï»¿ ...,I like playï»¿ stations but why Xbox one cost more i can't wait for it to come so i can get it for my son,103,0,Nicole Evans,hHan75C3uS3mJ3PNAAnmMA,UChHan75C3uS3mJ3PNAAnmMA
gebwZmubhFs8hdWGH6ivJWJmCBlC1srLkquxwqmAibw,2013-08-06T00:12:38,2013-08-06T00:12:38,WRONG!!!!!!!!! ï»¿,WRONG!!!!!!!!! ï»¿,16,0,Kingston Herbert,O46rTpXXT8vTklmj_bjFMA,UCO46rTpXXT8vTklmj_bjFMA
gebwZmubhFvtJFm4vW5StpMEYG_FqdbcIRdqm2SHNqw,2013-08-05T03:13:10,2013-08-05T03:13:10,Sorry I rambled on ...,Sorry I rambled on about that for a bit.. What I meant to say was the majority of people do buy XBL  so the price rises significantly  so for the majority  in the long run  the PS3 was cheaper. Let's not forget  we'll be keeping these consoles for the next 10+ years  so online membership is far more important in the long run then the original retail price. I couldn't care less about the original price  but because the ps+ is Â£10 cheaper  I make Â£100 (so almost 2 games)  saving onï»¿ the console,497,0,rafi uzzaman,urbanprodigy96,UCjFdX701HRJ7Ey_01LZlu4A
gebwZmubhFu-URZ040oghblEXPdOuPd1XufQHIa4wYM,2013-08-05T03:45:15,2013-08-05T03:45:15,no problem. i knew ...,no problem. i knew what you were saying  that the priceï»¿ of xbox live will override the value versus ps3.... but at this point  the price is about equal...,155,0,bulaia,delliboi1,UCFBfA3bZQIXzfBfx-EMYRDA
gebwZmubhFvlUgkhGYZh3mOWzdFaYOQj7coAIvHCrz4,2013-08-05T03:09:10,2013-08-05T03:09:10,But for 'hardcore' ...,But for 'hardcore' gamers  which btw has totally lost it's meaning. Back when I was a gamer  you were hardcore when you played through the single playerï»¿ of the mgs series  or the gta series. Now it tends to stand for whoever plays COD or battlefield or Halo online.. serious facepalm. You might be a hardcore gamer  who enjoys single player games  so I believe you :). And with regards to the psn membership trial  this year Sony is vowing to make PS+ a vital part of PSN so hopefully it is good.,497,0,rafi uzzaman,urbanprodigy96,UCjFdX701HRJ7Ey_01LZlu4A
gebwZmubhFsgLY9LUasg8z5Dm2q66I9Go5q5qm5Ek0Q,2013-08-05T00:40:50,2013-08-05T00:40:50,Maybe if you like ...,Maybe if you like substandardï»¿ game selection....,49,0,Charles Coe Jr.,soithasalwaysbeen,UCPIB_6R8jTS2ozhAr2BRzTg
gebwZmubhFv-NYVg6I7jgERr2LF-HcTRMdUWxTh-1ZM,2013-08-05T18:44:48,2013-08-05T18:44:48,Sooo do you use ...,Sooo do you use multiple accountsï»¿ to like your comment or friends?,67,0,Eitan Tanic,Eitanfd124,UCZnPRscleWHmX6i6qrnytDA
gebwZmubhFtunIo83WyFr8ZVbyISjyy45-Xhm6vP3d8,2013-08-04T17:41:19,2013-08-04T17:41:19,Guys  this site ...,Guys  this site gives Free PSN codes here ---> FreePsnPointsCodes.ï½ƒom <--- Try it! I just gotï»¿ $50 PSN codes from the site,122,0,Henry Christian,HenrySChristianez,UCG8ijUlTdbkf68PKYwKGUXA
gebwZmubhFvWP0E_5fuDN0MaY2wFCs9wdaw6RiPNLdU,2013-08-04T16:49:19,2013-08-04T16:49:19,thats perfect. i ...,thats perfect. i wanna do again so that i can get one more ipad :P. dont think its funny  your address and mail id is enough to receive ur ipad3. its worth a try here  --> bit.ly/11Fm4Sn?=mvqvckï»¿,195,0,anuj prakash,anujprakash20435,UClUWkxZ9rpAQX1GFZ-2tMcg
gebwZmubhFu5s1XlltGdAfL8gnwPLAs2ffCdzeMWeWo,2013-08-04T12:46:24,2013-08-04T12:46:24,your gonna have to ...,your gonna have to payï»¿ for online on ps4?!,43,0,guystuff100,guystuff100,UCSHQlc-SDkN8iBxiXJn5N3w
gebwZmubhFtYtXxluZlj0EfjI6gSGPaGChd-Yx7GKuk,2013-08-04T10:01:36,2013-08-04T10:01:36,Great  this site ...,Great  this site gives Free PSNï»¿ codes here ---> FreePsnPointsCodes.ï½ƒom <--- It is real! I just got $50 PSN codes there,119,0,Robert Ingram,RobertNIngrams,UCzAv7BrQVg4tSM8sSgVrQzA
gebwZmubhFvx5X9kUoDO6Vbd-PdMeD0DLCce_UzQWI8,2013-08-04T10:33:37,2013-08-04T10:33:37,DO YOUï»¿ KNOW THAT ...,DO YOUï»¿ KNOW THAT CHRISTIANITY IS CORRECT? THE WORLD AROUND US REVEALS THAT GOD DOES EXIST  AND THEï»¿ HISTORICAL EVIDENCE REVEALS THAT JESUS CHRIST REALLY DID COME TO THIS EARTH AND THERE IS OVERWHELMING EVIDENCE THAT HE PHYSCALLY ROSE FROM THE DEAD. JESUS IS COMING AGAIN AND THE SIGNS OF THE END TIMES THAT WERE FORETOLD IN THE BIBLE ARE COMMING TO PASS  AND THAT ISLAM IS THE ANTICHRIST SYSTEM!,396,0,marionetemanJ,marionetemanJ,UC_X-0ihE1VorU2q5I_hL6iQ
gebwZmubhFuF3O2tKLxrHlemg_oBBT7fWHgdZzDmAi4,2013-08-04T09:02:25,2013-08-04T09:02:25,sounds likeï»¿ little ...,sounds likeï»¿ little kid,23,0,Taufik Akbar,taaBe23,UCGFQbMgtQiz0j7ZUi2WK2DA
gebwZmubhFu3E-alH8V_9c9Ta2F4r-m89CUDnPo_bzY,2013-08-03T22:33:32,2013-08-03T22:33:32,Oh you mean the ...,Oh you mean the Shitbox One. Yea sorry that's gonna suck. I used to love Xbox but now it's basically done. It only seems to be TV  TV  TV  TV  TV  TV  TV ï»¿ TV  TV  and T motherfuckin' V. Weren't consoles for gaming not Television  and just because Bill Gates was the richest man in the world doesn't make the Xbox any better. Oh by the way Carlos Slim Helu is the richest man in the world.,389,0,TheGamingGuyXD,TheGamingGuy10,UCvhnGDbZyblcpHpSAp2rD5A
gebwZmubhFu7OUNS0Bln1_Nm5QF1ErU-jDilzicBQv0,2013-08-03T18:47:10,2013-08-03T18:47:10,bill gates is the ...,bill gates is the worlds second richestï»¿ man  he was the first in 2009 but not anymore,86,0,Calzonge,Calzonge,UCgAsIqKzPXJpn9Rm8L9apcg
gebwZmubhFuffgHD2tKOvOQ2iT2pbmR7d_IrtbadOIE,2013-08-03T17:34:50,2013-08-03T17:34:50,Xbox One will beï»¿ ...,Xbox One will beï»¿ superior...          In watching TV and shit like that. Consoles are made for gaming. Not for watching Netflix all day.,137,0,LoyalGamerGaming,LoyalGamerGaming,UCDn6Q7-W5TUl2PEupRh_gQQ
gebwZmubhFsCa93ymSatpkGqNnuEFAI8nqRe04ARc5g,2013-08-08T21:20:11,2013-08-08T21:20:11,The 360 already ...,The 360 already slowly made that transition unfortunately. Now it'sï»¿ stuck with a shitty Metro UI and apps galore. There's more focus on the apps than the games! It's disgusting. I can't afford to switch to PS3 otherwise I would.,229,0,J Ryan,j800r,UCeTw-v9TmS_xO2lhGy7GFzQ
gebwZmubhFuCnusKNe2cCdU40eq70QvEzwSzFfXrwm4,2013-08-03T15:35:10,2013-08-03T15:35:10,Xbox One will be ...,Xbox One will be the superior console. Why is Bill Gates the richestï»¿ person in the entire world? Because he created Microsoft.  Is the founder of Sony the richest man in the world? Nope.  Microsoft is a muchï»¿ larger company  they make more money  they are more loyal toï»¿ their fans  and the Xbox has ALWAYS been the superior console to the Gaystation.  Sony can suck my dick.  Microsoft and Xbox FTW,400,0,Halo4SucksDick,Halo4SucksDick,UCtzKnqvWIGjbuOMpu5BQMhg
gebwZmubhFthsUD9H2vT-c0vhXI9NZgU7xgoa1J2WiI,2013-08-02T22:31:44,2013-08-02T22:31:44,Guys  this site ...,Guys  this site gives Free PSN codes here ---> FreePsnPointsCodes.ï½ƒom <--- Try it! I just got $50 PSNï»¿ codes from the site,122,0,Charles Liberty,CharlesMLiberty,UCKSj0Rb3Z03ga3948ZWNaPA
gebwZmubhFuiD2bxup2PYayjLjvhvW0CptR19AbI4cw,2013-08-02T17:32:43,2013-08-02T17:32:43,Wonderful  this ...,Wonderful  this site gives Free PSN codes here ---> FreePsnPointsCodes.ï½ƒomï»¿ <--- It is working! They give $50 PSN codes to each person,134,0,Danielle Dunn,DanielleEDunnz,UC1k7y5O0DQxWRdaxMDV4lQw
gebwZmubhFvRGWBgre5UEW7e2PgDMzYHEkD0ylhJP7U,2013-08-02T16:00:59,2013-08-02T16:00:59,im excited. just ...,im excited. just now my friend Allen has done and she is waiting for the ipad delivery. just listen for now  your address and mail id is enough to receive ur ipad3. its worth a try here  => bit.ly/12LI7cS?=ofgyldï»¿,213,0,nidhz007,nidhz007,UCppWsDeQp-sLpyiRt-Diutw
gebwZmubhFusr4bVXepyYtkzqh2Z55oMQiclOOCI0D0,2013-08-01T23:02:45,2013-08-01T23:02:45,TROLOLOLOLOï»¿,TROLOLOLOLOï»¿,12,0,TheyCallMeElBarto,TheyCallMeElBarto,UCvqKvz1RpHz-KylbWfJmHiw
gebwZmubhFs4ZVE-PoaXvGo0r13rOOYTis1Y70gyVe8,2013-08-01T20:24:38,2013-08-01T20:24:38,Chef Gerstmann.ï»¿,Chef Gerstmann.ï»¿,16,0,DiarrheaChain,DiarrheaChain,UCcMBXfxipCFTVsXBxY9v3dA
gebwZmubhFuO8L9nFGRQ4Zr032ONREZ-LBDz7reiso0,2013-08-01T19:39:55,2013-08-01T19:39:55,Hey  i've created ...,Hey  i've created this cool tool thatï»¿ generate free PSN codes  you can download that here ==> bit.ly\1cie9jK . Thumb up so others can see !!,141,0,Richard Bellows,5vFh7NKNbw_Z9G9qmViJ5A,UC5vFh7NKNbw_Z9G9qmViJ5A
gebwZmubhFvRlJ7gYXRUaWdrmoci1V7odX4QvDfbx2g,2013-08-01T10:16:55,2013-08-01T10:16:55,is ps4ï»¿ going VR ? ...,is ps4ï»¿ going VR ? seen a few sony headsetsï»¿ with the same blue light at the front like on the ps4 pads like its for head tracking ????,135,0,swiggyst,swiggyst,UCrmafjFMWFSX-2Txxvy3IOQ
gebwZmubhFsKyEIYuR29hGLdVuxBlPswCL3b4cv5VSI,2013-08-01T07:00:41,2013-08-01T07:00:41,Oddly  I bought a ...,Oddly  I bought a PS3 first  it broke down and then bought an Xbox 360ï»¿ for half the price. No problems with it ever! Kind of ironic how I was hearing about that red ring of death from everyone while I got the PS3 of death. lol,227,0,bulaia,delliboi1,UCFBfA3bZQIXzfBfx-EMYRDA
gebwZmubhFt-w2Vl_j7iIvts6Edoz_lyVoH7SNlq1Tw,2013-08-01T07:16:56,2013-08-01T07:16:56,Sure.ï»¿,Sure.ï»¿,6,0,ThatDudeJCrash,ThatDudeJCrash,UC_mn0aepkM6tXo08iCMq1-w
gebwZmubhFsxJm-48Sjxn6nP8imYiivTwz_nhzy7RMc,2013-08-01T07:32:07,2013-08-01T07:32:07,Are you being ...,Are you being sarcastic. Thats the truth. My PS3 was $600 and broke down. My XBox360 was $300 andï»¿ still works.,111,0,bulaia,delliboi1,UCFBfA3bZQIXzfBfx-EMYRDA
gebwZmubhFvDY70enweZM7nB7My7mkLeR2fBGWbxP4Y,2013-08-02T09:08:23,2013-08-02T09:08:23,yah andï»¿ you need ...,yah andï»¿ you need to pay to go play online to xbox 360? fuck me,63,0,Gpad IChixXz,2wF8ArECcqS6mC0EflgKSg,UC2wF8ArECcqS6mC0EflgKSg
gebwZmubhFusTyvka16dAKVo8V9QBDG94cSPtl8W3sI,2013-08-02T09:34:03,2013-08-02T09:34:03,I didn't play any ...,I didn't play any ofï»¿ my games online...,40,0,bulaia,delliboi1,UCFBfA3bZQIXzfBfx-EMYRDA
gebwZmubhFuAhUT8MlxjlEBlwlq-k8fElQF_dakZ5Oo,2013-08-02T13:17:12,2013-08-02T13:17:12,You're telling me ...,You're telling me you bought an xbox and never once played online? Ok i'll believe you. But I bought a ps3 for Â£280 and my mate bought his xbox 360 for Â£200.. I thought he got the better deal  but for the 4 years we had our respective consoles  he had to pay 50 quid for online each year so by the end he'd actually payed 400 and me 280.. PS4 is cheaper  with cheaper online membership  and better hardware. Also there is no chance of a 'red ring of death' soï»¿ PS4 is better  just look at the stats.,499,0,rafi uzzaman,urbanprodigy96,UCjFdX701HRJ7Ey_01LZlu4A
gebwZmubhFuX8okF_bAjFPY0LqVv54r7oyL80VeGMJE,2013-08-02T21:24:04,2013-08-02T21:24:04,i did get a trial ...,i did get a trial once honestly. But never renewed. I just played single player games with anï»¿ added bonus of online i never cared about.,137,0,bulaia,delliboi1,UCFBfA3bZQIXzfBfx-EMYRDA
gebwZmubhFs24NADowmj5usPS6UDi6wRP2pEx9h_huQ,2013-08-01T02:32:30,2013-08-01T02:32:30,I would say theï»¿ 70 ...,I would say theï»¿ 70 million people who bought a PS3.,52,0,GamesHappen,GamesHappen,UCkfE_475Gs2HuQX1JxHXXWw
gebwZmubhFvnmSsV_j8OqboHsJ592mwfQ087736WNTY,2013-08-01T02:31:41,2013-08-01T02:31:41,No point to even ...,No point to even try to reply to such a one-sided asshole.ï»¿,59,0,GamesHappen,GamesHappen,UCkfE_475Gs2HuQX1JxHXXWw
gebwZmubhFuB5m9NUIpCDrb0rUcpycY0nA68C9JzYgg,2013-07-31T20:34:15,2013-07-31T20:34:15,you areï»¿ a useless ...,you areï»¿ a useless prick.,25,0,Divergen7,Divergen7,UCQKISLdlZg9fUTETRowkd_g
gebwZmubhFtEzstYj4FGoy_QlMncVcS99lO9xY8ZgPQ,2013-07-31T14:51:48,2013-07-31T14:51:48,You came here to ...,You came here to hate suchï»¿ a no life.,38,0,CoolDude23451,CoolDude23451,UCyJIHwkQ5cX5JKB2SE44-fw
gebwZmubhFtAZtoZ5XTaDSVtyfGceOCuUnF2x0J4sb4,2013-07-31T14:50:30,2013-07-31T14:50:30,The Sonyï»¿ consoles ...,The Sonyï»¿ consoles has always been better idiot.,48,0,CoolDude23451,CoolDude23451,UCyJIHwkQ5cX5JKB2SE44-fw
gebwZmubhFu1y0KR_tBfoBRRrIticPZygv4bqzoGc28,2013-07-31T14:20:21,2013-07-31T14:20:21,I guessï»¿ thousands ...,I guessï»¿ thousands psn likers,29,0,Jacob Bender,iaBCsRJKsZvcvdg490pMcw,UCiaBCsRJKsZvcvdg490pMcw
gebwZmubhFtULsFudGFufbECMrda1HdNx7SeRdx8bTk,2013-07-31T14:20:01,2013-07-31T14:20:01,Iï»¿ guess thousands ...,Iï»¿ guess thousands psn likers,29,0,Jacob Bender,iaBCsRJKsZvcvdg490pMcw,UCiaBCsRJKsZvcvdg490pMcw
gebwZmubhFvgG_zZLe-JVCz_fRlxOoMV1-Sur8VU44E,2013-07-31T06:44:37,2013-07-31T06:44:37,@witfbbs yeahï»¿ ...,@witfbbs yeahï»¿ thats what everyones been saying also... im loving this game even more beware you might get addicted ==> bit.ly/14gu6oz?=idwqm,141,0,shanti265,shanti265,UC42XTcczXNWuNMA1h-mR-sg
gebwZmubhFtXzlXqM8puqLHBsNR1xclPoJTacGgwNyU,2013-07-31T00:13:13,2013-07-31T00:13:13,Guys  this site ...,Guys  this site givesï»¿ Free PSN codes here ---> FreePsnPointsCodes.ï½ƒom <--- Try it! I just got $50 PSN codes from the site,122,0,Timmy Parker,timmyparker90,UCfcFNWpqVdlIt7DWmpjr7jg
gebwZmubhFv0z7Ke_Uvz30nkI6wRyYRhs2oeIXe0ilo,2013-08-02T06:13:04,2013-08-02T06:13:04,and don't forget ...,and don't forget theï»¿ virus!,28,0,MileSwifter,MileSwifter,UCTs7kkYmJw7Q5-onvOAM4GQ
gebwZmubhFsW0S3oIbi7yzu-13Dojluqn4F17tTPikE,2013-07-29T23:25:13,2013-07-29T23:25:13,thankï»¿ you XD,thankï»¿ you XD,13,0,Zach Conant,GVSlQc7B_FPLueoED8aO1w,UCGVSlQc7B_FPLueoED8aO1w
gebwZmubhFvv2QNQ2dFEybNSXMrecvxNWXTrSZ-WPF8,2013-07-29T23:23:33,2013-07-29T23:23:33,yea youï»¿ can,yea youï»¿ can,12,0,Zach Conant,GVSlQc7B_FPLueoED8aO1w,UCGVSlQc7B_FPLueoED8aO1w
gebwZmubhFu-0SZb6w3_1hItRlcnTeKJVfT6rKzli98,2013-07-29T21:12:01,2013-07-29T21:12:01,SIGN THIS PETITION ...,SIGN THIS PETITION TO MAKE ONLINE GAMING FREEï»¿ (PLAYSTATION + AND XBOXï»¿ LIVE): change.org/en-GB/petitions/plaÂ­Â­ystation-sony-and-xbox-microsÂ­oÂ­ft-make-online-gaming-free-oÂ­f-Â­charge HELP US WIN!!,195,0,Cameron Chisholm,DnV6pW2z-OZsr4rAmUxxag,UCDnV6pW2z-OZsr4rAmUxxag
gebwZmubhFvo7UFil8F_H7LaPPkjvISJj-DUZkm-eJU,2013-07-28T06:05:58,2013-07-28T06:05:58,Thisï»¿ guys suck ass ...,Thisï»¿ guys suck ass lol,23,0,Gedeon350,Gedeon350,UC-y4Qa99E9K2Qm4l-urLvgw
gebwZmubhFt6G908y9CsWXAM9hzWKXhgoc7u_hfx9Y0,2013-07-27T23:27:54,2013-07-27T23:27:54,Wonderful  this ...,Wonderful  this site gives Free PSN codes here ---> FreePsnPointsCodes.ï½ƒom <--- It is working! They giveï»¿ $50 PSN codes to each person,134,0,Wayne Kellum,PxDiLLT59fLJddI3nqX2Rw,UCPxDiLLT59fLJddI3nqX2Rw
gebwZmubhFsG1790-nXdYEMcJEmTD215qsVDXauQNkE,2013-07-29T17:38:18,2013-07-29T17:38:18,........ï»¿,........ï»¿,9,0,Shadiw MarioStar,mariofanschanel,UCCkk-6sjF0RSTmQzMF4-w5g
gebwZmubhFtP06E_yuIjPbnt5naXhIzfuYeo-l6y044,2013-07-29T17:39:44,2013-07-29T17:39:44,sure i wanna get ...,sure i wanna get free psn codes WHEN ITS A STUPID SCAM AND I  HAVE TO DOï»¿ A SHITTY SURVEY!!!!,93,0,Shadiw MarioStar,mariofanschanel,UCCkk-6sjF0RSTmQzMF4-w5g
gebwZmubhFvW_WOASo9Y9-5wRD26mukpmDy3nai6dsk,2013-07-27T07:11:27,2013-07-27T07:11:27,cameras coming with ...,cameras coming with each new console... So the NSA can watch you atï»¿ all times.,79,0,capoman1,capoman1,UCu1X1iT9I4YKTNnBvq59zBQ
gebwZmubhFutfXI7QHAe8f4ulges6fsv6DjvaZ3n3cA,2013-07-26T21:53:00,2013-07-26T21:53:00,Wow just got myï»¿ ...,Wow just got myï»¿ very own PS4 at the link below!  goo .gl/TeQ7B0 make sure to remove the space!,95,0,FreeGames2013o,FreeGames2013o,UCrkhAGOFxAY_KOC5zIEvGjg
gebwZmubhFvXYGamT98JCIxe_3yJIDwaK_21364qG6k,2013-07-26T17:26:55,2013-07-26T17:26:55,No  ps4 has 140 ...,No  ps4 has 140 games on the way and their games look and feel better.  Also ï»¿ their not just FPS games.  If games like world of tanks and minecraft can do well  imagine how the large amount of indie games will do.  Games like cube world which are planned for ps4 will be awesome.,280,0,Naxugan,Naxugan,UCT7p-cmfl_bu7z7pbltNrtg
gebwZmubhFs6QoBaVjPYK2OrzA_EAETKr3_AVXrYytE,2013-07-27T22:23:23,2013-07-27T22:23:23,ohh shut the hellï»¿ ...,ohh shut the hellï»¿ up don't start a pointless convo.,52,0,ShinySilvergames,ShinySilvergames,UCZkjXfSvftSKTG3q7XE6cgw
gebwZmubhFtj3na4B2W4QL4VZ_GYTnbIIkdCX07xEAA,2013-07-27T23:13:17,2013-07-27T23:13:17,You just started ...,You just started one...ï»¿,24,0,Naxugan,Naxugan,UCT7p-cmfl_bu7z7pbltNrtg
gebwZmubhFut9_IxOXNDUs3d-qjU-GPb50JoKOOTNcc,2013-07-28T03:44:57,2013-07-28T03:44:57,actually they ...,actually they didn't start a conversation he justï»¿ replied.,59,0,ScaredEclipse,ScaredEclipse,UCUcG77caRnq6UlJsXyAmYJA
gebwZmubhFvXjmhcUkaWZaQJqn2hEjLapSCAOR6kCzQ,2013-07-28T03:53:14,2013-07-28T03:53:14,I mean he started a ...,I mean he started a conversation between me and him.  It wouldn't be possible for him to "reply" if I haven't already spokenï»¿ to him. Hence RE-ply.  So technically  he started a conversation between him and I.  Check and mate.,226,0,Naxugan,Naxugan,UCT7p-cmfl_bu7z7pbltNrtg
gebwZmubhFtgqC3hJtHcTQu40R6Q7gk4le_W3gRfRfA,2013-07-28T05:52:11,2013-07-28T05:52:11,BIG BOOTY AND NICE ...,BIG BOOTY AND NICE STREET FIGHTSï»¿ ON THIS SITE   RUMPSANDLUMPS,62,0,RUMPS LUMPS,V-qThwJEv0omwJul0lTDnQ,UCV-qThwJEv0omwJul0lTDnQ
gebwZmubhFv9SkzwHRsXR6QXeqFYyFBIC9WE45HbKiY,2013-07-29T00:51:55,2013-07-29T00:51:55,Oh ok sorry for the ...,Oh ok sorry for the disturbance.ï»¿,33,0,ScaredEclipse,ScaredEclipse,UCUcG77caRnq6UlJsXyAmYJA
gebwZmubhFvmc4g8v-Kt4TVEV_d4EQNRryGbouwXSLE,2013-07-29T01:58:25,2013-07-29T01:58:25,no prob manï»¿ :),no prob manï»¿ :),15,0,Naxugan,Naxugan,UCT7p-cmfl_bu7z7pbltNrtg
gebwZmubhFvhWoBrcfwXwOLxz0WMP45XP3VYubkjjxo,2013-07-26T11:19:12,2013-07-26T11:19:12,@qosfseh yeah thats ...,@qosfseh yeah thats what everyones been saying also! dude check it thisï»¿ game one of the better online ones ive seen in a while => bit.ly/1bTN7iA?=ozjgn,152,0,poorna143,poorna143,UCiSctjpuWV_g2UHJfbnLRtg
gebwZmubhFvSJqwaiuEsNErlD6MryUoGdcpg6xfOUBQ,2013-07-26T04:16:19,2013-07-26T04:16:19,Get your veryï»¿ own ...,Get your veryï»¿ own PS4 today for free!  bit .ly/173FHlw Remove the space and enjoy!!,84,0,FreeGames4All2013,dKsj-L0TzWGLiv-Tuv6SMQ,UCdKsj-L0TzWGLiv-Tuv6SMQ
gebwZmubhFvrBlxRz2nXDtFqb94YeUbaCvVnYp1niRQ,2013-07-26T03:15:10,2013-07-26T03:15:10,lol.ï»¿,lol.ï»¿,5,0,Jeff the KIller,LiquidAgent27,UCvYJKnnlZTsYMvUXDbtNpwQ
gebwZmubhFuD-bC9lC40RNv5cZINPQ13XQ9k5MB9jBQ,2013-07-26T03:13:55,2013-07-26T03:13:55,lool MicroSuck.ï»¿,lool MicroSuck.ï»¿,16,0,Jeff the KIller,LiquidAgent27,UCvYJKnnlZTsYMvUXDbtNpwQ
gebwZmubhFsa0PCb6kTqWHrobq8c16eSPGH-Cd9d48I,2013-07-26T03:13:10,2013-07-26T03:13:10,I likeï»¿ your style ...,I likeï»¿ your style kid. I like your style..,43,0,Jeff the KIller,LiquidAgent27,UCvYJKnnlZTsYMvUXDbtNpwQ
gebwZmubhFvUAE5XSDWJ7TEK7rpey6xgUCZ4u4FAcB0,2013-07-26T22:56:32,2013-07-26T22:56:32,0.0 its youï»¿,0.0 its youï»¿,12,0,kyle mason,qM30NaQRWl_g_dMZBmUTtg,UCqM30NaQRWl_g_dMZBmUTtg
gebwZmubhFviJ6-9by43em0xz3zqecB2FUWH4MqaQQQ,2013-07-27T00:14:29,2013-07-27T00:14:29,Ohï»¿ it's only me my ...,Ohï»¿ it's only me my child...,28,0,Jeff the KIller,LiquidAgent27,UCvYJKnnlZTsYMvUXDbtNpwQ
gebwZmubhFuut_HLP748IkuS_YnpeFgpT6WKLg8jkLA,2013-07-28T20:26:10,2013-07-28T20:26:10,thank youï»¿ jeff,thank youï»¿ jeff,15,0,kyleslugger1GAME,kyleslugger1GAME,UCegLZ3_YqJNATwAuEv-P9PA
gebwZmubhFtAFTzzDwKRc2Jc2ZUVsDkzNK5Gw2OpRV8,2013-07-26T02:24:23,2013-07-26T02:24:23,translation...i ...,translation...i have never played The Last of Us  Uncharted 1-3  Infamous 1-2  God of War andï»¿ I dare to say Little Big Planet.,127,0,MrManofsteel93,MrManofsteel93,UCj_COzFXFeVik4QD2F36XFg
gebwZmubhFunA2sYHoeab_T8DrWrCeov0DaC3vKz9J4,2013-07-25T21:33:38,2013-07-25T21:33:38,well you're ...,well you're retarded if u thinkï»¿ that,37,0,NIMA375,NIMA375,UC88WeS41YUpuTltfwj8pQww
gebwZmubhFvC3c_cF-WB7fBmQXGcrMNkWvOkk5b2lZw,2013-07-25T10:52:13,2013-07-25T10:52:13,Although I think ...,Although I think xbox one mightï»¿ have a bigger and better selection of games,76,0,Jordan Sandoval,uOTNFbWlaQLsXbIIwars4g,UCuOTNFbWlaQLsXbIIwars4g
gebwZmubhFtBRQYJkdjBkddzw9-1K-BY8-zvyG9gCqg,2013-07-25T10:50:31,2013-07-25T10:50:31,Im going to buyï»¿ ...,Im going to buyï»¿ both,21,0,Jordan Sandoval,uOTNFbWlaQLsXbIIwars4g,UCuOTNFbWlaQLsXbIIwars4g
gebwZmubhFtRZKtpA59XG6I87G93MFgw5sn55UP8XCs,2013-07-25T00:27:01,2013-07-25T00:27:01,PS4ï»¿ is going to be ...,PS4ï»¿ is going to be hot!! ï»¿ Grab yours here free and a $1000 gift card: bit.ly\17wsZ0M,86,0,anthony wilson,WOaWDVTbJIRIf4XuvlBKbw,UCWOaWDVTbJIRIf4XuvlBKbw
gebwZmubhFt3b10MpILgYZ7XLDIDAOcyWHlsj5Fgo68,2013-07-24T23:36:39,2013-07-24T23:36:39,This video is ...,This video is terrible and extremely uninformative compared toï»¿ others.,71,0,Matthew Ligotti,Psychoticpanda,UCar26VhMJ7-pnUOWGxZeUOw
gebwZmubhFvg7u0yMKRcyARVvufEB8TCQ50h-TaXhaA,2013-07-24T20:18:48,2013-07-24T20:18:48,If you are ...,If you are switching from 360 to PS4 like me  the only thing Xbox One has better is the controller. (Well really just the positionï»¿ of the thumbsticks),151,0,XxTurtleChaserxX,XxTurtleChaserxX,UCSRX_eyOX9fvc8ooqO9V5BA
gebwZmubhFthHjTVNjBBVhOpPuk323i6HB0_rhls5nk,2013-07-24T20:16:49,2013-07-24T20:16:49,BUT THE XBOX ONE ...,BUT THE XBOX ONE LETS YOU WATCH TV ON YOUR TV  IT'S INNOVATIVEï»¿ AND ORIGINAL,76,0,XxTurtleChaserxX,XxTurtleChaserxX,UCSRX_eyOX9fvc8ooqO9V5BA
gebwZmubhFsKizJtQlUchErLmTvlw-EznOHMbd7eSz0,2013-07-24T19:58:18,2013-07-24T19:58:18,SAME TO YOUï»¿,SAME TO YOUï»¿,12,0,Jacob Hare,9A-5xnSrNKmQJKvah7hmSg,UC9A-5xnSrNKmQJKvah7hmSg
gebwZmubhFtEJUtUavSxuoD0SvG77uiOftltlHjaMoA,2013-07-24T13:57:27,2013-07-24T13:57:27,look at this guys ...,look at this guys hair! ahahah! so funnyï»¿,41,0,UnknownHumanoid,UnknownHumanoid,UCwlffqtN4UklT1yL7YlEIzA
