ID,PUBLISHED,UPDATED,TITLE,CONTENT,CONTENT_SIZE,HAS_LINK,AUTHOR_NAME,AUTHOR_URI,CHANNELID
gebwZmubhFvlkUZ3iHek_jhZ6IEyU5eQnRrjxme2Xg8,2013-07-01T17:20:05,2013-07-01T17:20:05,Sony almost had the ...,Sony almost had the DRM policy too in till they sawï»¿ it was going bad for Xbox. So they quicky removed it. Fuck you Sony fans that say "Sony listens to there gamers and Microsoft doesn't" They were listening to the WALLETS!,223,0,ThatTechguy5000,ThatTechguy5000,UCmHxHk0o_phun-xDyDSa2rA
gebwZmubhFv20UkLNb3HryYpdRUkePzwcIkatGd2O18,2013-07-01T15:56:27,2013-07-01T15:56:27,best systemï»¿ ps4 ...,best systemï»¿ ps4 but how price it i think 500$,46,0,good boy,godboy51,UCQjyBRdAtH06by-XOXDstXg
gebwZmubhFtMP9lagEc75mDgTFYJmqGTUuILWMWJ75Q,2013-07-02T07:44:36,2013-07-02T07:44:36,600 hundred if you ...,600 hundred if you countï»¿ the warenty.lol,41,0,brandon kluth,kluth7754,UCsnUF4A2-qLNVG_Z7zUc6Zg
gebwZmubhFuF7FggygwE7iSwoAMDdOvHwxvi5HlyRfc,2013-07-03T02:40:14,2013-07-03T02:40:14,It'sï»¿ $399,It'sï»¿ $399,10,0,lewis4642011,lewis4642011,UCsCeh-_wVmcTm_ovfABLSeg
gebwZmubhFvnmaTYSFyeDhQeh5ASNC629urAck-lHbI,2013-07-04T10:46:31,2013-07-04T10:46:31,no tax?ï»¿ cuz if ...,no tax?ï»¿ cuz if theres tax it goes up to $500,45,0,braXas N luck,pQ5ce-Jw9CjvzL55pYHQAg,UCpQ5ce-Jw9CjvzL55pYHQAg
gebwZmubhFvsjiJZpJL-vSky0f-d_0OynvwnYbuMZoQ,2013-07-04T11:09:47,2013-07-04T11:09:47,I'm not sure.. I ...,I'm not sure.. I knowï»¿ for certain that the UK price Â£349 does include tax.,75,0,lewis4642011,lewis4642011,UCsCeh-_wVmcTm_ovfABLSeg
gebwZmubhFtdyBUDKz9cgno6tix8lZmjtrgIu8D0_f4,2013-07-04T18:38:40,2013-07-04T18:38:40,yeah  if the tax ...,yeah  if the tax was 25%...ï»¿,28,0,Mike Rumsis,IxdS_8iSOhZgc_E87xCLmQ,UCIxdS_8iSOhZgc_E87xCLmQ
gebwZmubhFv0NNh46BUXQO4d10bQZbv6sBircpaTloQ,2013-07-01T13:40:20,2013-07-01T13:40:20,found a working psn ...,found a working psn codeï»¿ generatorï»¿ NO SURVEY mediafireï»¿ legal %100 no ban allï»¿ countries yep.it\ruihql,104,0,wendy bendy,bilal40009,UCZr7fUu3IyE4xT0UMEivdWw
gebwZmubhFtwXEIvLF6t0MntIKtglS6san-hikOmNeU,2013-07-01T12:22:09,2013-07-01T12:22:09,Obvious trollï»¿ is a ...,Obvious trollï»¿ is a very obvious. It was confirmed a long time ago PS4 will have a HDMI-IN.,91,0,xXMLGCreatureCatsXx,xXMLGCreatureCatsXx,UCScTwU8fw7LmAUPEnHQ61Ew
gebwZmubhFs-sy05_m23Pxg1OlvyMqklgHxS4K4u-SI,2013-07-01T00:18:03,2013-07-01T00:18:03,$460ï»¿,$460ï»¿,5,0,Jacob Hare,9A-5xnSrNKmQJKvah7hmSg,UC9A-5xnSrNKmQJKvah7hmSg
gebwZmubhFs4WqXMWLdcFL6dz1vXYWZw6THpSYEOss8,2013-07-01T00:17:20,2013-07-01T00:17:20,YES IT WILLï»¿ GO TO ...,YES IT WILLï»¿ GO TO GAMESTOP.COM,31,0,Jacob Hare,9A-5xnSrNKmQJKvah7hmSg,UC9A-5xnSrNKmQJKvah7hmSg
gebwZmubhFs8cHPpsAqdff9Kq5sLAJcM3M6m9UcA9Oo,2013-06-30T23:04:11,2013-06-30T23:04:11,How doï»¿ you charge ...,How doï»¿ you charge the controller,33,0,326israel,326israel,UChrr2dHPckhYw3_66GaL4Ug
gebwZmubhFtYORr6pyYf6EhQmgla_kPtV_8AOsrDFs8,2013-06-30T21:22:56,2013-06-30T21:22:56,troll alert troll ...,troll alert troll alertï»¿,24,0,innoutpandaexpresss,innoutpandaexpresss,UCYxUbiU47K1pM3MCvp6jxqg
gebwZmubhFvxXt2NssVyT_FdLxEe9GlIcNSQbMC0qbE,2013-06-30T19:23:59,2013-06-30T19:23:59,Hmm their most ...,Hmm their most likely going to release it near Christmas.Darn summer would of been a good time to try out the features seeing as most will probably be with their familyï»¿ for most of Christmas.,192,0,max107sky,max107sky,UCP-8sFaYSqGqdQH8He3s5yQ
gebwZmubhFtKgyX7rRyQoPRlumzDilPN4LLjebiaSx8,2013-06-30T02:48:35,2013-06-30T02:48:35,@egdpyju yeah man i ...,@egdpyju yeah man i know what you mean also! dude this game is tight been playing allï»¿ day => bit.ly/13hiK1D?=ofvzf,115,0,Kartik Jain,TheKartik268,UCg85BJ5D2Qvu9k6TOLau41g
gebwZmubhFvO_WDAmEiNXDJyRdprpNskwsgy_3xvsAA,2013-06-30T01:57:44,2013-06-30T01:57:44,Hahaha sure thing  ...,Hahaha sure thing  think what you want about me :) You have a pathetic existence and you know it. Enjoy sitting in your angry dark cave of denial  delusion and loneliness. Best stay there troll  the real world benefits greatly from your reclusive nature  means there's less litter on the streets :D It's a shame your shit has to go on youtube though  it makes sense why  you attempting to belittle people by so desperately trying to seem superior is the only gratification you get. Dude ï»¿ grow up.,497,0,JoshShwah,JoshShwah,UCH45TZ7fUdbglCLadU4RWrw
gebwZmubhFsWGVwaVSKiKuh0tKfYkfcrwKkZmOpnLHc,2013-06-30T19:33:17,2013-06-30T19:33:17,lol like i said ...,lol like i said NERDY ASS DWEEB lmfao! do you feel better now after that one? do you feel like you put me in my place?? were you finally able to get a goods night restï»¿ now that you got that moving and inspirational and life changing comment onto youtube?? lmao that was the funniest comment i have ever read! thanks =p,319,0,Oscar Cortes,tQUYwFt3MIUSNKR27zMb_w,UCtQUYwFt3MIUSNKR27zMb_w
gebwZmubhFtLC2OW5a6K5AShGpFrtVFXE376Eq1Sopk,2013-06-29T20:27:10,2013-06-29T20:27:10,good consolï»¿,good consolï»¿,12,0,matthew bain,Zs8qn8Uiwv-pFzRYwy70dA,UCZs8qn8Uiwv-pFzRYwy70dA
gebwZmubhFtWkYaHJZVACPEV3i5pYjcf9ttRW4_a8nU,2013-06-29T04:50:50,2013-06-29T04:50:50,Proof theï»¿ PS4 is ...,Proof theï»¿ PS4 is bad at running games: /watch?v=PGo7WuC8LKc,60,1,thebossmaster99,thebossmaster99,UCDaPaSzbtOrUDCAtxt6bkZw
gebwZmubhFufSiw5f5IcAe3Sd0neBfv-oJh787VrAA4,2013-06-28T23:59:41,2013-06-28T23:59:41,Why you so angry?  ...,Why you so angry?  Was just pointing out how hypocritical you sound when you try to call some one else out.  Before you try to call someone out on stupidity make sure you check your selfï»¿ first,193,0,austin mullins,trx420fm1,UCKPTB4p1LaNteGESIgf59ng
gebwZmubhFuVAp0slk8QB5qnL7wW55IUFPsBqXkIAes,2013-06-28T20:13:58,2013-06-28T20:13:58,That'sï»¿ not an ...,That'sï»¿ not an explination  I've already stated the facts  you're just ignoring them and throwing out random numbers.,117,0,themixedarts,themixedarts,UCyFbTqp3a10Y3rh7lDi8Tkg
gebwZmubhFvCcIfVWE-5j3U2HzX03Dg2ElgvL4ArR6w,2013-06-28T20:05:50,2013-06-28T20:05:50,PS2 RULES!ï»¿,PS2 RULES!ï»¿,11,0,Viso031,Viso031,UCX1WvSsta4y85ETEIET8t4Q
gebwZmubhFsNjNLZ7AwSiJzVGzhP83w3xUnjSOul1Dk,2013-06-28T18:12:53,2013-06-28T18:12:53,Do u gotta payï»¿ for ...,Do u gotta payï»¿ for online onï»¿ ps4?? And if yes how much???,59,0,TecHno652,TecHno652,UCz_voEVtfFNdgUm_gqOqRXA
gebwZmubhFuciO2T0vI9avqvemEUn8HV8K1PtuSJB3w,2013-06-28T16:11:14,2013-06-28T16:11:14,Click show the ...,Click show the comment to go on an adventure! PS and Xbox are both awesome. Why do you peopleï»¿ have to be so radical.,117,0,AelitezJakeChaos,AelitezJakeChaos,UC9uXyeWL-vucr9LK_DH8T1A
gebwZmubhFvMhPFn6yzRdSTnuU1rZ9o-on4sB_443M0,2013-06-28T02:21:38,2013-06-28T02:21:38,Lol  you're the one ...,Lol  you're the one acting like an ignorant kid. "It's 5%  no it's just .5%." You can'tï»¿ even give an explination as to why I'm wrong.,134,0,themixedarts,themixedarts,UCyFbTqp3a10Y3rh7lDi8Tkg
gebwZmubhFv_UGvldykM3mUKAvoucnY1RhEyBqoehuc,2013-06-28T00:22:33,2013-06-28T00:22:33,The butthurt is ...,The butthurt is strong with thisï»¿ one.,38,0,themixedarts,themixedarts,UCyFbTqp3a10Y3rh7lDi8Tkg
gebwZmubhFtVdOiY6JsnwlgjMCGTdjiL78aJ3tgEwbc,2013-06-27T20:25:17,2013-06-27T20:25:17,It's more than 5%  ...,It's more than 5%  PS4 has more than double the bandwith  and again higher fill rates ï»¿ more shaders  larger screen resolutions  TFLOP's  etc.,142,0,themixedarts,themixedarts,UCyFbTqp3a10Y3rh7lDi8Tkg
gebwZmubhFs4jle4zwwjoketbaK44cgJfT7RrJTNBrY,2013-06-27T20:15:15,2013-06-27T20:15:15,I mean you can turn ...,I mean you can turn on your ps3 or xbox and play those games  it just would have been really nice if they would have madeï»¿ it cross play to play games with friends. I know i wont be having every new game that comes out so yeah ._.,230,0,ali4live,ali4live,UCFEQDCvxfI74cDZONeOyVcg
gebwZmubhFu1XOYQ2CPY5rDE2CjgRMuvkv7KXcvVQFY,2013-06-27T14:53:28,2013-06-27T14:53:28,Dude I'm Christian ...,Dude I'm Christian C I Played lots of Game you don't need to subscribe just watch my video and that's enough toï»¿ me   THANK YOU FOR READING,139,0,Christian C Gameplay,ChristiancGaming,UCoo1S-70tcarjkX_Y1VPJZg
gebwZmubhFvLhLx4cMPXhg8HEZKPTNUVPaJTbiGKAgg,2013-06-27T06:38:07,2013-06-27T06:38:07,Cutï»¿ to the chase! ...,Cutï»¿ to the chase! Can I watch TV on it ???,43,0,MyDoom01,MyDoom01,UCDxRqD6wYVwzq-Ddx-ggRJg
gebwZmubhFsyeuwWsQQsYkSoHyZ7qXd8YZ-FqanmwpQ,2013-06-27T04:15:56,2013-06-27T04:15:56,wellï»¿ everyone ...,wellï»¿ everyone shouldï»¿ get a second chance right we like the xbox 360 now maybe we will love the xbox one,105,0,voltage7406,voltage7406,UC9H-8fYzgqeU00fgH5jMwig
gebwZmubhFvEpGuSIO_Jgj1-CUJqWAKDcLQw7H5ko8o,2013-06-27T03:50:55,2013-06-27T03:50:55,lol I will have fun ...,lol I will have fun borrowing games and buying used games as well.  But I am mainly a pc gamer so their old way wasï»¿ just like steam so it wasn't bad at all.  Also  microsoft won't see you at all  maybe the NSA but if they wanted they could easily see you through your phone with its two cameras.,296,0,3DragonBZ,3DragonBZ,UCwcm-dpECO8IdHf1EdTkZwg
gebwZmubhFuhQeZ-5L6uDNeMdY259i7-Ej9L4F0TyoY,2013-06-27T02:21:51,2013-06-27T02:21:51,lol you just wish ...,lol you just wish your life is as good as mine..jealousy is an ugly look for you especially over youtube..kindaï»¿ sad actually,125,0,Oscar Cortes,tQUYwFt3MIUSNKR27zMb_w,UCtQUYwFt3MIUSNKR27zMb_w
gebwZmubhFtcbFaHCmIWTbME4E_v1_IFoZWQkKEKd_c,2013-06-27T02:11:13,2013-06-27T02:11:13,im 24 and ive ...,im 24 and ive worked forï»¿ everything i have now and i grew up poor and made something of myself. unlike you who will prolly be working for me when you grow up..stop trying to make up your own facts about my life to make whatever points you are trying to make valid,264,0,Oscar Cortes,tQUYwFt3MIUSNKR27zMb_w,UCtQUYwFt3MIUSNKR27zMb_w
gebwZmubhFvvtY0Gpm6LyGp5IUjWu74AnYPEBLGhguE,2013-06-27T02:02:41,2013-06-27T02:02:41,For those of you ...,For those of you buying aï»¿ PS4  be sure to check out H-HOUR Worlds Elite. It's a crowd sourced tactical shooter. You can learn more by going to Kickstarter. Unless you want the same old crap that we've been getting for the past 10 years. H-HOUR is based off real teamwork ï»¿ objective based game modes  organized clans  competitive battles  epic white knuckle gun fights etc...No big producer will force H-HOUR to be developed like some "fast food" shooter. Get it on day 1 and form your clan.,492,0,Dexler Afinogenov,dXZS_eXLsrJw2lV9VCfhEA,UCdXZS_eXLsrJw2lV9VCfhEA
gebwZmubhFv4WSMvs-5p1rds2QY4xEQfJZgg78L0Ez0,2013-06-27T01:20:04,2013-06-27T01:20:04,You act like Sony ...,You act like Sony announced every exclusive it's going to release. Dead Rising 3 will release later on PS4 I guarantee that. Halo was ruined by 313.ï»¿ Ryse looks like a bunch of quick time events. We got Warframe and Planetside 2 for online exclusives.,251,0,WakaFlameFlakes,WakaFlameFlakes,UCf8F7pMQxFQU-fxPaF9ZYcg
gebwZmubhFv0T-uGP5IFPVlsUmIrPpnvvvC8daTWaIU,2013-06-27T00:43:02,2013-06-27T00:43:02,PS4 hasï»¿ better ...,PS4 hasï»¿ better specs  around 50% more graphical math power  much higher fill rates  shaders  etc. Games are opinion as usual  same for controller.,147,0,themixedarts,themixedarts,UCyFbTqp3a10Y3rh7lDi8Tkg
gebwZmubhFsZYIH6xwbFOaUbB0zUyAmLvBTFyAbQmfc,2013-06-27T03:52:11,2013-06-27T03:52:11,lol did you really ...,lol did you really just say 50% moreï»¿ graphical math power.  God your an idiot.,79,0,3DragonBZ,3DragonBZ,UCwcm-dpECO8IdHf1EdTkZwg
gebwZmubhFs5uoV3cWVnUOJKsBfFogYVZJNQjQ2vNl0,2013-06-27T04:08:59,2013-06-27T04:08:59,What'sï»¿ inaccurate ...,What'sï»¿ inaccurate about that? and It's *you're* genius.,56,0,themixedarts,themixedarts,UCyFbTqp3a10Y3rh7lDi8Tkg
gebwZmubhFtsFrEziBO7tIaYV9rWaBlBfcB3bawlGcI,2013-06-27T04:20:50,2013-06-27T04:20:50,I could make a ...,I could make a grammatical mistake in everyï»¿ word and still look smarter than you and your statement.  You obviously don't know why xbox was designed with its specs.,165,0,3DragonBZ,3DragonBZ,UCwcm-dpECO8IdHf1EdTkZwg
gebwZmubhFve4t5KLp-gG3Z_Ht5dRB3o0bqGRvKOGy8,2013-06-27T10:57:37,2013-06-27T10:57:37,I see nothing ...,I see nothing intelligent from you yet  don't expect to. Let me guess ï»¿ so they could throw in their gimmicky Kinect 2  and don't give me any BS about their 'cloud' renderingï»¿ technology. Btw graphical power and graphical math power aren't the same thing  they're different. You call me an idiot for describing it unorthodoxly butï»¿ it just shows you obviously have no experience in game programming  so either go get anal fucked like the guy in your picture or get a fucking clue.,480,0,themixedarts,themixedarts,UCyFbTqp3a10Y3rh7lDi8Tkg
gebwZmubhFvGZNGGSqsgr3BuPF4vKsnZsPEP-hb1G3k,2013-06-28T04:17:38,2013-06-28T04:17:38,Its good you ...,Its good you removed your comment  I was beginning to get worried you might hurtï»¿ yourself with your stupidity.,111,0,3DragonBZ,3DragonBZ,UCwcm-dpECO8IdHf1EdTkZwg
gebwZmubhFsX5AJXq_XSr7bIaCvRmoQvdWheS4b1CI0,2013-06-29T11:22:31,2013-06-29T11:22:31,you obviously need ...,you obviously need to research or learnï»¿ reg. PC specs,54,0,Jason Brody,armward69,UCc8t9VoxoQRMpXi940z1u6Q
gebwZmubhFuetg7rIdi7fqTUUTMJFZUJh6apdbXqaCw,2013-06-30T03:33:00,2013-06-30T03:33:00,Sure I do ï»¿ maybe ...,Sure I do ï»¿ maybe on my next pc build I will.,45,0,3DragonBZ,3DragonBZ,UCwcm-dpECO8IdHf1EdTkZwg
gebwZmubhFsHeI6PZHBhvouvOpafItrLq5ABSDERDEI,2013-06-30T02:38:55,2013-06-30T02:38:55,this coming from ...,this coming from the person who referring graphicï»¿ performance to "math power"?,79,0,YourNintendoBoy,YourNintendoBoy,UCNSev6MJZMghS7wmzFG35GA
gebwZmubhFuSK4W6os94CjY2A2usdGAysuAHxyx25Vs,2013-06-30T03:33:21,2013-06-30T03:33:21,Don't know if your ...,Don't know if your making aï»¿ jab at me or the person I replied to >.>,69,0,3DragonBZ,3DragonBZ,UCwcm-dpECO8IdHf1EdTkZwg
gebwZmubhFssGdpGL1WulVJHs-ze9C4QOT5iV80Vyog,2013-06-30T18:52:14,2013-06-30T18:52:14,click (Showï»¿ the ...,click (Showï»¿ the comment) to go on an adventure!,48,0,Josh Katz,28Joshk,UCXQl1aFwsQ0BNJMEH0WUVqA
gebwZmubhFs-2ZSsXJtgbinlPRsZVkTD04EP_s3AUfM,2013-06-26T20:54:15,2013-06-26T20:54:15,Wellï»¿ if you ask me ...,Wellï»¿ if you ask me MS deserves it for trying to force all their crap on people.,80,0,themixedarts,themixedarts,UCyFbTqp3a10Y3rh7lDi8Tkg
gebwZmubhFuDwzHl_2B_vvW08cbytiZWSL_LrkUg6BU,2013-06-26T15:26:34,2013-06-26T15:26:34,yes i mean it  this ...,yes i mean it  this is really fantastic. and i can tell u  i really didn't expect that this siteï»¿ would send me a check of $240 for doing some surveys. if you wanna try just try now: bit.ly\17g0EMQ,197,0,naif alzamel,sayhi259,UC-zd8jnI7IyLB2CFGwoAtqg
gebwZmubhFtwCqRtsB79lqq60VGqXjNn4nuKe0yMvXM,2013-06-26T14:37:37,2013-06-26T14:37:37,its a ps3.5 nothing ...,its a ps3.5 nothing new on this waste of spaceï»¿ console but a number(4) and updated graphics. youll be a dumbass to buy this. probably is more prone to being hacked! again. indie indie indie indie imdie indie indie indie indie indie indie indie indie indie indie indie indie indie indie indie indie indie indie indie.......ughh,327,0,LacedChux,LacedChux,UCudGQ6pg3S2zfb1L297wBSQ
gebwZmubhFtZqoF8YOxfNvgtMl1RgWIc9QiiRG0VORY,2013-06-26T14:16:35,2013-06-26T14:16:35,I have searched for ...,I have searched for 15 minutes in this comment section and I have only found THREEï»¿ people saying Xbox is better  while in all the Xbox's videos it is like five times as much saying Playstation is best.,202,0,zukodark,zukodark,UCMdcWcRjx0jw5X8LEZqBXRw
gebwZmubhFv05urTqZxR-BCtSwmagcUpUizjZLuAV5A,2013-06-26T14:12:47,2013-06-26T14:12:47,This is a troll. He ...,This is a troll. He could never have a good job with so badï»¿ grammar.,69,0,zukodark,zukodark,UCMdcWcRjx0jw5X8LEZqBXRw
gebwZmubhFvxbVcD_psOYOSuoXIGTFcm3RrV3shYKZ8,2013-06-27T02:20:17,2013-06-27T02:20:17,lol *such badï»¿ ...,lol *such badï»¿ grammar not so bad grammar lmao nice attempt at trying to comment on my grammar and your comment being grammatically incorrect lol,145,0,Oscar Cortes,tQUYwFt3MIUSNKR27zMb_w,UCtQUYwFt3MIUSNKR27zMb_w
gebwZmubhFuqfxtYxnX8XUwyqqdhi1h2PMITUUiabEg,2013-06-27T06:30:11,2013-06-27T06:30:11,I never told you I ...,I never told you I have perfect grammar. This was aboutï»¿ you.,61,0,zukodark,zukodark,UCMdcWcRjx0jw5X8LEZqBXRw
gebwZmubhFtgTSjIz-fa9fvbxP4xj2Sw15BNfPbxyzc,2013-06-27T17:29:21,2013-06-27T17:29:21,my grammar is fine. ...,my grammar is fine. what you are referring to is the lack of punctuation in my comment..but there is not a single word in there that is misspelled or used out of context and your inability to even write one sentence without fucking it up leads me to believe that you are not the one who should not even be thinking about commenting on someone else's grammar. how can you comment on someone else's grammar when you know nothing about it? thats like a gym teacher trying to teachï»¿ rocket science!,494,0,Oscar Cortes,tQUYwFt3MIUSNKR27zMb_w,UCtQUYwFt3MIUSNKR27zMb_w
gebwZmubhFu0vuUhYClseUmdkTGbmzo7BG2LfrkyTEQ,2013-06-26T14:09:12,2013-06-26T14:09:12,Youï»¿ have to pay ...,Youï»¿ have to pay more for Xbox One,34,0,zukodark,zukodark,UCMdcWcRjx0jw5X8LEZqBXRw
gebwZmubhFtdLnUQKgn0TBzclW3NDQ420tnFdKuBnp4,2013-06-26T14:07:37,2013-06-26T14:07:37,Unlike Xbox One ...,Unlike Xbox One whoï»¿ only accept the rich people...,51,0,zukodark,zukodark,UCMdcWcRjx0jw5X8LEZqBXRw
gebwZmubhFtFW8ytkU8QXX4CNgyZpMiW3S770hsVhDs,2013-06-26T10:58:01,2013-06-26T10:58:01,These guys areï»¿ so ...,These guys areï»¿ so awkward.. Definitely true gamers.,52,0,Wishful Thinking,Whistfulthinking,UCeBENzSqFtEmpMj_3A7G1jg
gebwZmubhFsB-xVKP2jXhV1FylhQ1hvc-kfCAAQIDOE,2013-06-26T07:54:31,2013-06-26T07:54:31,Just a xbox fan boy ...,Just a xbox fan boy rollingï»¿ through *insert insult about ps4*,62,0,TheRealNOAHZARATE,TheRealNOAHZARATE,UCdeBVQpsdturM-NuW0C0CFQ
gebwZmubhFs7ecgNl1wAZAxeLQ0Pn6Pl_oN_NJpih1Q,2013-06-26T03:29:01,2013-06-26T03:29:01,Never heard of that ...,Never heard of that butï»¿ I'm positive PS4 will sell more  talk shit about X1 even their official video and you'll get 50+ thumbs up with little hate from fanboys.,162,0,themixedarts,themixedarts,UCyFbTqp3a10Y3rh7lDi8Tkg
gebwZmubhFt_aFo2BjZ4qZuA_PT30e-P6uLI1i9VvyM,2013-06-26T00:45:24,2013-06-26T00:45:24,dude in the funny ...,dude in the funny blackï»¿ jacket just woke up,44,0,MontaFan8,MontaFan8,UC1sGtPqFRruhZK35Vp0FS0A
gebwZmubhFsOFUweyve2GCSfdnvA7HQ9Cf8Gilg9OgI,2013-06-25T23:10:52,2013-06-25T23:10:52,anyone notice how ...,anyone notice how the xbox fans can put together a sentence without sounding like a moron.could it beï»¿ that xbox makes it's consumers even more retarded?,153,1,TheBr0seph,TheBr0seph,UCtGRMAi64LG8AvIqrj9lvyA
gebwZmubhFtF-7uYjA7ljSsG1nJ_zwfDap9ANOcG578,2013-06-25T23:06:42,2013-06-25T23:06:42,alot of people are ...,alot of people are argueing over a fucking machine? come on guys  just pick a machine you want and have fun. don't wasteï»¿ your time just by being a negative asshat.  its like pokemon  you can either choose fire  water or plant at the start. and then get on with it... ^^,270,0,Arcade Cannibal,N6mhMRvHQUQFEisceqNipg,UCN6mhMRvHQUQFEisceqNipg
gebwZmubhFv34pBqyOjfCDrHOpXrWCwUGOr_ph7-YLM,2013-06-25T19:57:25,2013-06-25T19:57:25,PS4 is ahead in UK  ...,PS4 is ahead in UK  US  apparently not Canadaï»¿ and I can't find the Australia best sellers...,93,0,themixedarts,themixedarts,UCyFbTqp3a10Y3rh7lDi8Tkg
gebwZmubhFuOnxlk-yOTwG2zd3JFN_xwwBBZjMFNwkI,2013-06-25T15:49:59,2013-06-25T15:49:59,I might go with ps4 ...,I might go with ps4. I went through ps1 ps2 then xbox360. I still am but after hearing that bull shit for the xbox one and the layout and live tv  even though theyï»¿ changed the policies Im still not getting it. Its like a punch to a baby. Im not going to get the xbox one. Its better to become different then to stay the same.,326,0,Aviation2016,Aviation2016,UC2Gjz2C75V9fnCHTZYpwX7g
gebwZmubhFtJLPG1SV8MtB40J2iYv0X5WITshW1sIRg,2013-06-25T10:10:24,2013-06-25T10:10:24,X1 is not ...,X1 is not outselling PS4  the PS4 sold out of pre-orders so it doesn't appear anymore. Go to amazons best sellers 2013ï»¿ video game category  PS4 is ahead.,154,0,themixedarts,themixedarts,UCyFbTqp3a10Y3rh7lDi8Tkg
gebwZmubhFtERqdesV6E2FbKKBW01gKRek3734Je-ns,2013-06-25T08:19:18,2013-06-25T08:19:18,Lol you're a ...,Lol you're a fucking idiotï»¿ "mate",34,0,Haddan Ward,Nl-ZDh-XnA7zMYz6Cuoj5w,UCNl-ZDh-XnA7zMYz6Cuoj5w
gebwZmubhFtdC9Bcec0Ia8iaQTizb4HkeUU7xekIaLc,2013-06-25T08:02:32,2013-06-25T08:02:32,can you playï»¿ ps3 ...,can you playï»¿ ps3 games on ps4,30,0,rasmus adolfsson,G5fVjndP4mhkJiA10kNxDQ,UCG5fVjndP4mhkJiA10kNxDQ
gebwZmubhFsfIXdrUAJjUs6-3V_EWfIUvBFrFUKi648,2013-06-25T03:37:16,2013-06-25T03:37:16,Notï»¿ once did I ...,Notï»¿ once did I mention any of the policies that the Xbox One has. So your comment "is no longer relevant". Idiot.,114,0,BlankandAnonymous,BlankandAnonymous,UC6ku4zjvuOixLaFuZ6ePIMQ
gebwZmubhFv760fB81jAtEOUwUUJjct1IGumbmqIeWA,2013-06-25T03:12:22,2013-06-25T03:12:22,Lol  perfect ...,Lol  perfect example of how rich kids are full of themselves.ï»¿,62,0,David Jon-Lay,yankskid1215,UCln0qzHJbWYbdqGqJz6bh6A
gebwZmubhFteuKSmlrfxNziBZzBRvzbBD9UFCMto-Zg,2013-06-25T03:09:50,2013-06-25T03:09:50,Ps4 looks good  btw ...,Ps4 looks good  btw.ï»¿,21,0,prodieseltrucker,prodieseltrucker,UCl_qiQ75qqPwWIUDT1lrxCw
gebwZmubhFv1gTgc2Y4uZOFJjW7OGoKBnxxKhkyz9DY,2013-06-25T03:09:44,2013-06-25T03:09:44,the fat dude ..why ...,the fat dude ..why you came in front a camera with your hair mess up ..  I think he was like idc and idgaf ..people not gon pay attentions of my hair messï»¿ up,158,0,charlie2011ful,charlie2011ful,UCSNIVYsW6OEoHIM35o2sJVw
gebwZmubhFt18TFV8L9qyvDDLkMB-lk70O7SaYaRcns,2013-06-25T03:09:16,2013-06-25T03:09:16,Consoles are for ...,Consoles are for gaming.  Always have been.  TV's are for entertainment.  Always have been.  Pc's are for everything you can think of.  If ps4 is for games and Xbox one is for entertainment...  What do you get?  A console and a fricking tv for your tv  dawg.ï»¿,259,0,prodieseltrucker,prodieseltrucker,UCl_qiQ75qqPwWIUDT1lrxCw
gebwZmubhFvB8aRlqgkLfwJ4rAXFVhutn3pof4gkQio,2013-06-25T00:39:27,2013-06-25T00:39:27,I am always ...,I am always suprised at theï»¿ bitterness of some comments. If you dont like what you see then comment in a civilised way - it wont cost you anything. Like the info and will be a buyer - need to preorder,201,0,Greenhall Leonard,dheQ_CKngNkwaCxDAok_vg,UCdheQ_CKngNkwaCxDAok_vg
gebwZmubhFvlrbgJm5Gnv2we8kOoh-OrFzM6Eiw7d14,2013-06-24T22:15:29,2013-06-24T22:15:29,Your comments tell ...,Your comments tell US how you are a stupid little kid that lies aboutï»¿ your life,80,0,Mad Hatter,ihaspizza2,UChEjwHJFCkkhEr4xyxpyQvw
gebwZmubhFv6hUkszRv7vFaTblRsj_QRCzS3OrjVZ_Q,2013-06-24T22:13:30,2013-06-24T22:13:30,Lol you haveï»¿ no ...,Lol you haveï»¿ no comebacks,26,0,Mad Hatter,ihaspizza2,UChEjwHJFCkkhEr4xyxpyQvw
gebwZmubhFshSWcHWU7mHF0dkTXW1THNT6h8yeRFqFE,2013-06-24T22:12:40,2013-06-24T22:12:40,Just leave no one ...,Just leave no one cares forï»¿ you.,33,0,Mad Hatter,ihaspizza2,UChEjwHJFCkkhEr4xyxpyQvw
gebwZmubhFtTCV2Zu6XgjQWGi6HjxPxx8V0gko-oGI8,2013-06-24T22:07:14,2013-06-24T22:07:14,Do you have to say ...,Do you have to say "lol" a lot.Know we know why you dont have goodï»¿ grammar cause you "rich" i bet you you are'nt now stop saying how you want your life to be,158,0,Mad Hatter,ihaspizza2,UChEjwHJFCkkhEr4xyxpyQvw
gebwZmubhFsUfm_dlvMJviFnyZ-8-9wpJm8c16NCNE8,2013-06-24T18:49:32,2013-06-24T18:49:32,how many peopleï»¿ ...,how many peopleï»¿ will be able to chat together in cross game chat on the ps4?,77,0,General72700,General72700,UCZKr4HgibZNWkXJfg8OcWpA
gebwZmubhFuPWUDl7pcq55nXPStOAfSoPO3W4k0vCjI,2013-06-24T07:03:51,2013-06-24T07:03:51,Xbox 360 wasï»¿ an ...,Xbox 360 wasï»¿ an amazing console.Besides Microsoft won''t have those DRM issues anymore.,88,0,ibrahim kane,1QtR9HBavJaPJIYjg8NKTw,UC1QtR9HBavJaPJIYjg8NKTw
gebwZmubhFvBhHK3_cHyxgJFPyotekvqVMJFaLjPpYw,2013-06-24T06:48:25,2013-06-24T06:48:25,wowww!!! that ...,wowww!!! that controller isï»¿ the best!!,39,1,Gabriel Soto,gaby2759,UCdJuSbT72q-TFhHCl2dXH6w
gebwZmubhFuyn-P1EoRaXBx8xGNooCbq0YBuVM3q0ww,2013-06-24T02:25:32,2013-06-24T02:25:32,I wishï»¿ ps3 or ps4 ...,I wishï»¿ ps3 or ps4 had minecraft,32,0,Kris Bohnen,Dmzjc0o26Iawr6Ln0AW9pw,UCDmzjc0o26Iawr6Ln0AW9pw
gebwZmubhFt69kdK3qtYSvX34PZpGWpWRofMSnA64_s,2013-06-24T01:49:05,2013-06-24T01:49:05,you have to pay for ...,you have to pay for the ps4 now and xbox is still better so stfu loser and get aï»¿ life,86,0,NcBaLL3r,NcBaLL3r,UCwcS4vrgZ3SU1wbAG-7WEqw
gebwZmubhFvPWKXo9_TNZbIIvABypO2d_IgUQmCKedk,2013-06-24T22:10:46,2013-06-24T22:10:46,We have a life you ...,We have a life you don't you spend all day on the XBOX.Don't come here and say its better this video isn't about Xbox you idiot Now you have to get aï»¿ life,155,0,Mad Hatter,ihaspizza2,UChEjwHJFCkkhEr4xyxpyQvw
gebwZmubhFvoT6DMsngVMkIGsCbZKkmFDArqZ0du4F8,2013-06-24T01:48:30,2013-06-24T01:48:30,youï»¿ have to pay ...,youï»¿ have to pay for ps4 now idiot and xbox is still better,59,0,NcBaLL3r,NcBaLL3r,UCwcS4vrgZ3SU1wbAG-7WEqw
gebwZmubhFtAqVuX3uKOfXmGtrzbMHxMCjszVvcW-cw,2013-06-24T08:34:23,2013-06-24T08:34:23,How isï»¿ it better?,How isï»¿ it better?,18,0,ENDER1550,ENDER1550,UCDktqt_Qi22RW38LxA1OtbQ
gebwZmubhFvbVyXYuViYcicg6y82F4PGTDeFzVBCW6A,2013-06-24T12:22:26,2013-06-24T12:22:26,the exclusivesï»¿ are ...,the exclusivesï»¿ are really good,31,0,gordonandsandy,gordonandsandy,UCPoLDCEBqBTgrdPA1_dfymg
gebwZmubhFvbEWQ8vpkX3fV1rZTS564Nws5m6VO76zM,2013-06-24T12:28:06,2013-06-24T12:28:06,Andï»¿ because of ...,Andï»¿ because of that the xbox is better?,40,0,ENDER1550,ENDER1550,UCDktqt_Qi22RW38LxA1OtbQ
